{
  "license": "https://www.apache.org/licenses/LICENSE-2.0",
  "$schema": "https://json-schema.org/draft/2020-12/schema",
  "$id": "https://w3id.org/battinfo/schema/cell-instance.schema.json",
  "title": "BattINFO Cell Instance",
  "description": "A physical cell realizing a cell spec.",
  "type": "object",
  "additionalProperties": false,
  "required": [
    "schema_version",
    "cell_instance",
    "provenance"
  ],
  "properties": {
    "schema_version": {
      "type": "string",
      "pattern": "^\\d+\\.\\d+\\.\\d+(-[A-Za-z0-9.-]+)?$",
      "description": "Version of the record schema this document conforms to (semantic versioning); stamped by the library on save."
    },
    "cell_instance": {
      "type": "object",
      "additionalProperties": false,
      "required": [
        "id",
        "cell_spec_id"
      ],
      "properties": {
        "id": {
          "$ref": "#/$defs/CellIri",
          "description": "Canonical IRI of this cell instance."
        },
        "cell_spec_id": {
          "$ref": "#/$defs/SpecIri",
          "description": "IRI of the cell spec this physical cell realizes."
        },
        "working_electrode_id": {
          "$ref": "#/$defs/ElectrodeIri",
          "description": "Canonical IRI of the electrode record (the physical batch or disc) built into this cell as its working electrode. The cell spec says which electrode design the cell uses; this says which built electrode went into this individual cell."
        },
        "counter_electrode_id": {
          "$ref": "#/$defs/ElectrodeIri",
          "description": "Canonical IRI of the electrode record built into this cell as its counter electrode. In a half cell that electrode is also the reference electrode, so it is emitted with both role classes."
        },
        "name": {
          "type": "string",
          "description": "Human-readable name / label for this cell (e.g. a lab batch ID). The primary identifier; usually present even without a manufacturer serial number."
        },
        "handle": {
          "$ref": "#/$defs/Handle",
          "description": "Short readable slug, unique within one registry workspace (e.g. 'flores-ocv/graphite-aq-1-063b77-cell'). Display text, never part of the identity."
        },
        "short_id": {
          "$ref": "#/$defs/ShortId"
        },
        "serial_number": {
          "type": "string",
          "description": "Manufacturer serial number (unique within the product model); optional."
        },
        "batch_id": {
          "type": "string",
          "description": "Production or lab batch this cell belongs to."
        },
        "grade": {
          "type": "string",
          "description": "Quality grade assigned to this cell (e.g. 'A', 'B', 'C', 'reject')."
        },
        "manufactured_at": {
          "$ref": "#/$defs/FlexDate",
          "description": "Production date. ISO 8601 string (YYYY, YYYY-MM, YYYY-MM-DD) or Unix timestamp."
        },
        "expires_at": {
          "$ref": "#/$defs/FlexDate",
          "description": "Expiration / best-before date. ISO 8601 string (YYYY, YYYY-MM, YYYY-MM-DD) or Unix timestamp."
        },
        "service_start_date": {
          "type": "string",
          "format": "date",
          "description": "ISO 8601 date when the battery was first put into service."
        },
        "battery_status": {
          "type": "string",
          "enum": [
            "original",
            "repurposed",
            "re-used",
            "remanufactured",
            "waste"
          ],
          "description": "Current status of the battery per EU Battery Regulation Annex XIII."
        },
        "dpp_status": {
          "type": "string",
          "enum": [
            "active",
            "archived",
            "inactive",
            "marked-for-deletion"
          ],
          "description": "Status of this digital product passport record."
        },
        "supersedes": {
          "$ref": "#/$defs/CellIri",
          "description": "IRI of the previous cell record this passport replaces, e.g. after repurposing."
        },
        "conformance": {
          "type": "object",
          "description": "Assessment of how well this record followed the spec that governs it.",
          "additionalProperties": false,
          "required": [
            "status"
          ],
          "properties": {
            "status": {
              "type": "string",
              "enum": [
                "conformant",
                "non-conformant",
                "unknown"
              ],
              "description": "Overall conformance verdict."
            },
            "note": {
              "type": "string",
              "description": "Free-text summary of the assessment."
            },
            "deviations": {
              "type": "array",
              "items": {
                "type": "object",
                "additionalProperties": false,
                "required": [
                  "category"
                ],
                "properties": {
                  "category": {
                    "type": "string",
                    "enum": [
                      "power_outage",
                      "equipment_failure",
                      "temperature_excursion",
                      "software_error",
                      "operator_intervention",
                      "premature_termination",
                      "communication_loss",
                      "parameter_drift",
                      "setpoint_deviation",
                      "calibration_issue",
                      "out_of_tolerance",
                      "dimensional",
                      "other"
                    ],
                    "description": "Broad classification of the deviation."
                  },
                  "type": {
                    "type": "string",
                    "description": "Specific deviation label within the category (free text)."
                  },
                  "description": {
                    "type": "string",
                    "description": "Free-text description of the deviation."
                  },
                  "occurred_at": {
                    "type": [
                      "integer",
                      "string"
                    ],
                    "description": "When the deviation occurred (ISO 8601 string or Unix timestamp)."
                  },
                  "duration_s": {
                    "type": "integer",
                    "minimum": 0,
                    "description": "Duration of the deviation in seconds."
                  },
                  "step_index": {
                    "type": "integer",
                    "minimum": 0,
                    "description": "Zero-based protocol step during which the deviation occurred."
                  },
                  "impact": {
                    "type": "string",
                    "enum": [
                      "minor",
                      "moderate",
                      "major"
                    ],
                    "description": "Assessed impact severity of the deviation."
                  }
                }
              },
              "description": "Individual deviations from the governing spec or protocol."
            }
          }
        }
      },
      "description": "The physical cell being described."
    },
    "measured": {
      "$ref": "cell-canonical.schema.json#/$defs/SpecSet",
      "description": "Measured cell properties using the same keys as the spec's properties map; read each key as the value measured for this cell (e.g. nominal_capacity = measured discharge capacity, mass = weighed mass)."
    },
    "provenance": {
      "type": "object",
      "additionalProperties": false,
      "required": [
        "source_type"
      ],
      "properties": {
        "source_type": {
          "type": "string",
          "enum": [
            "measurement",
            "lab",
            "bms",
            "other"
          ],
          "description": "Kind of source this record was created from."
        },
        "source_url": {
          "oneOf": [
            {
              "type": "string",
              "format": "uri"
            },
            {
              "type": "null"
            }
          ],
          "description": "URL of the source document or landing page, when available."
        },
        "citation": {
          "type": "string",
          "format": "uri",
          "description": "Resolvable citation target to use for attribution, typically a DOI URL."
        },
        "citation_doi": {
          "type": "string",
          "pattern": "^10\\.\\d{4,9}/[-._;()/:A-Za-z0-9]+$",
          "description": "DOI of the source publication (bare '10.xxxx/...' form). Prefer provenance.citation with a DOI resolver URL."
        },
        "retrieved_at": {
          "$ref": "#/$defs/UnixTime",
          "description": "Unix timestamp (seconds since epoch, UTC) when the source was retrieved or the record was captured."
        },
        "source_name": {
          "type": "string",
          "description": "Human-readable name of the source (document title, instrument, lab, or system)."
        },
        "source_file": {
          "anyOf": [
            {
              "type": "string"
            },
            {
              "type": "null"
            }
          ],
          "description": "Filename or path of the source file, when the record was derived from a file."
        },
        "file_hash": {
          "type": "string",
          "pattern": "^[A-Fa-f0-9]{64}$",
          "description": "SHA-256 hash of the source file, for integrity verification."
        },
        "workflow_version": {
          "type": "string",
          "description": "Version of the ingest/curation workflow that produced this record."
        },
        "curated_by": {
          "type": "string",
          "description": "Name or identifier of the person who curated this record."
        },
        "comment": {
          "type": "string",
          "description": "Free-text provenance comment."
        },
        "battinfo_version": {
          "type": "string",
          "pattern": "^\\d+\\.\\d+\\.\\d+(((a|b|rc)\\d+)?(\\.post\\d+)?(\\.dev\\d+)?(\\+[A-Za-z0-9.]+)?|-[A-Za-z0-9.-]+)$",
          "description": "Version of the battinfo library that wrote this record, stamped on save: X.Y.Z with an optional PEP 440 suffix (0.8.0rc1, 0.8.0.dev1, 0.8.0.post1, 0.8.0+local) or a hyphenated one (0.8.0-rc1)."
        }
      },
      "description": "Where the information in this record came from: source type, file or URL, citation, and retrieval time."
    },
    "datasets": {
      "type": "array",
      "items": {
        "$ref": "#/$defs/DatasetLink"
      },
      "uniqueItems": true,
      "description": "Datasets recorded for this cell. Back-reference to dataset records. dataset.about is the source of truth for what a dataset describes; when records are saved together through a workspace the library fills this list from each dataset's cell and test links, and hand-authored records may set it directly."
    },
    "notes": {
      "type": "array",
      "items": {
        "type": "string"
      },
      "description": "Free-text notes carried with the record."
    },
    "license": {
      "type": "string",
      "minLength": 1,
      "description": "License under which this record and its data are released, as an SPDX license identifier (e.g. \"cc-by-4.0\") or a license URL. Stamped from the workspace default (ws.license) and emitted as dcterms:license in JSON-LD."
    },
    "funding": {
      "$ref": "#/$defs/Funding",
      "description": "Funding project (grant) under which the record was produced."
    },
    "contributor": {
      "type": "array",
      "items": {
        "$ref": "#/$defs/Person"
      },
      "minItems": 1,
      "description": "People who contributed this record to the platform (attribution/provenance). Each is a schema:Person; an ORCID may be given in same_as. Distinct from data authorship (creators)."
    }
  },
  "$defs": {
    "UnixTime": {
      "type": "integer",
      "minimum": 0,
      "description": "Unix timestamp in whole seconds since 1970-01-01T00:00:00Z."
    },
    "FlexDate": {
      "oneOf": [
        {
          "$ref": "#/$defs/UnixTime"
        },
        {
          "type": "string",
          "description": "ISO 8601 calendar date string: YYYY, YYYY-MM, or YYYY-MM-DD.",
          "pattern": "^\\d{4}(-\\d{2}(-\\d{2})?)?$"
        }
      ],
      "description": "Date as an ISO 8601 string (YYYY, YYYY-MM, or YYYY-MM-DD) or a Unix timestamp in seconds."
    },
    "ShortId": {
      "type": "string",
      "pattern": "^[0-9a-hjkmnp-tv-z]{6,16}$",
      "description": "Short human-friendly identifier derived from the record IRI (Crockford base32, 6-16 characters)."
    },
    "Handle": {
      "type": "string",
      "pattern": "^[a-z0-9]+(?:-[a-z0-9]+)*(?:/[a-z0-9]+(?:-[a-z0-9]+)*)*$",
      "maxLength": 120,
      "description": "Short readable slug for this record, unique within one registry workspace and shown as <workspace>/<handle> (e.g. 'flores-ocv/graphite-aq-1-063b77-cell'). Lowercase ASCII segments joined by '/', each made of letters and digits separated by single hyphens; at most 120 characters. Display text only: the record's identity is its IRI, and a handle may be corrected without moving it. Build one with battinfo.naming.handle_for()."
    },
    "CellIri": {
      "type": "string",
      "pattern": "^https://w3id\\.org/battinfo/cell/[0-9a-hjkmnp-tv-z]{4}(?:-[0-9a-hjkmnp-tv-z]{4}){3}$",
      "description": "Canonical BattINFO IRI in the cell/ namespace (https://w3id.org/battinfo/cell/xxxx-xxxx-xxxx-xxxx)."
    },
    "DatasetIri": {
      "type": "string",
      "pattern": "^https://w3id\\.org/battinfo/dataset/[0-9a-hjkmnp-tv-z]{4}(?:-[0-9a-hjkmnp-tv-z]{4}){3}$",
      "description": "Canonical BattINFO IRI in the dataset/ namespace (https://w3id.org/battinfo/dataset/xxxx-xxxx-xxxx-xxxx)."
    },
    "DatasetLink": {
      "type": "object",
      "additionalProperties": false,
      "required": [
        "id"
      ],
      "properties": {
        "id": {
          "$ref": "#/$defs/DatasetIri",
          "description": "Canonical IRI of the linked dataset record."
        },
        "role": {
          "type": "string",
          "enum": [
            "raw",
            "processed",
            "report",
            "metadata",
            "other"
          ],
          "description": "Role of the linked dataset as a whole relative to this record (record level; the per-file role lives on the dataset's distribution entries)."
        }
      },
      "description": "Link to a dataset record, with the role the dataset plays for this record."
    },
    "SpecIri": {
      "type": "string",
      "pattern": "^https://w3id\\.org/battinfo/(?:spec|material-spec|electrode-spec|separator-spec|electrolyte-spec|current-collector-spec|housing-spec)/[0-9a-hjkmnp-tv-z]{4}(?:-[0-9a-hjkmnp-tv-z]{4}){3}$"
    },
    "ElectrodeIri": {
      "type": "string",
      "pattern": "^https://w3id\\.org/battinfo/electrode/[0-9a-hjkmnp-tv-z]{4}(?:-[0-9a-hjkmnp-tv-z]{4}){3}$"
    },
    "Funding": {
      "type": "object",
      "additionalProperties": false,
      "description": "Funding project (grant) under which the record was produced. Maps to schema:funding / schema:Grant in JSON-LD.",
      "required": [
        "identifier"
      ],
      "properties": {
        "type": {
          "const": "Grant",
          "description": "JSON-LD type discriminator."
        },
        "id": {
          "type": "string",
          "format": "uri",
          "description": "Resolvable IRI of the grant (e.g. a CORDIS project IRI)."
        },
        "identifier": {
          "type": "string",
          "minLength": 1,
          "description": "Grant number as assigned by the funder (e.g. '101069765')."
        },
        "name": {
          "type": "string",
          "description": "Project title."
        },
        "acronym": {
          "type": "string",
          "description": "Project acronym."
        },
        "program": {
          "type": "string",
          "description": "Funding programme or call (e.g. 'Horizon Europe')."
        },
        "funder": {
          "type": "object",
          "additionalProperties": false,
          "required": [
            "name"
          ],
          "properties": {
            "type": {
              "const": "Organization",
              "description": "JSON-LD type discriminator."
            },
            "name": {
              "type": "string",
              "minLength": 1,
              "description": "Funder name (e.g. 'European Commission')."
            },
            "url": {
              "type": "string",
              "format": "uri",
              "description": "Funder homepage URL."
            },
            "same_as": {
              "type": "string",
              "format": "uri",
              "description": "External identifier IRI for the funder (e.g. a ROR or DOI funder IRI)."
            }
          },
          "description": "Organization that awarded the grant."
        }
      }
    },
    "Organization": {
      "type": "object",
      "additionalProperties": false,
      "required": [
        "name"
      ],
      "properties": {
        "type": {
          "const": "Organization",
          "description": "JSON-LD type discriminator."
        },
        "name": {
          "type": "string",
          "minLength": 1,
          "description": "Organization name."
        },
        "url": {
          "type": "string",
          "format": "uri",
          "description": "Homepage URL."
        },
        "same_as": {
          "type": "string",
          "format": "uri",
          "description": "External identifier IRI for this organization (e.g. ROR or Wikidata)."
        }
      },
      "description": "An organization referenced by name, with an optional canonical BattINFO organization IRI."
    },
    "Person": {
      "type": "object",
      "additionalProperties": false,
      "required": [
        "name"
      ],
      "properties": {
        "type": {
          "const": "Person",
          "description": "JSON-LD type discriminator."
        },
        "name": {
          "type": "string",
          "minLength": 1,
          "description": "Full name."
        },
        "given_name": {
          "type": "string",
          "minLength": 1,
          "description": "Given (first) name."
        },
        "family_name": {
          "type": "string",
          "minLength": 1,
          "description": "Family (last) name."
        },
        "email": {
          "type": "string",
          "format": "email",
          "description": "Contact e-mail address."
        },
        "url": {
          "type": "string",
          "format": "uri",
          "description": "Personal or institutional web page."
        },
        "same_as": {
          "type": "string",
          "format": "uri",
          "description": "External identifier IRI, typically an ORCID (https://orcid.org/...)."
        },
        "affiliation": {
          "$ref": "#/$defs/Organization",
          "description": "Organization the person is affiliated with."
        }
      },
      "description": "A person, in schema.org Person terms; an ORCID may be given in same_as."
    }
  }
}
